<?xml version="1.0" encoding="UTF-8"?>
<config xmlns="http://www.griphyn.org/chimera/GVDS-PoolConfig" 
xsi:schemaLocation="http://www.griphyn.org/chimera/GVDS  http://www.griphyn.org/chimera/gvds-poolcfg-1.5.xsd" 
xmlns:xsi="http://www.w3.org/2001/XMLSchema-instance" version="1.5">


  <pool handle="teraport" sysinfo="INTEL32::LINUX">
    <gridftp url="gsiftp://tp-grid1.ci.uchicago.edu" storage="/home/hategan/scratch/i2u2" major="2" minor="2" patch="4"> 
    </gridftp>
    <jobmanager universe="vanilla" url="tp-grid1.ci.uchicago.edu/jobmanager-pbs" major="2" minor="2" patch="4" />
    <workdirectory>/home/hategan/scratch/i2u2</workdirectory>
    <profile namespace="GLOBUS" key="queue">fast</profile>
    <profile namespace="ENV" key="PATH">/bin:/usr/bin:/usr/local/bin:/home/hategan/i2u2/bin</profile>
  </pool>
  
  <pool handle="aux" sysinfo="INTEL32::LINUX">
    <gridftp  url="local://localhost" storage="/var/tmp" major="1" minor="0" patch="0" />
    <jobmanager universe="vanilla" url="local://localhost" major="1" minor="0" patch="0" />
    <workdirectory>/sandbox/quarkcat/tmp</workdirectory>
    <profile namespace="SWIFT" key="storagesize">40000000000</profile>
  </pool>
</config>
