<?xml version="1.0" encoding="UTF-8"?>
<!--Generated Wed Aug 17 15:17:52 PDT 2005-->
<!--Generated by gmehta [US] -->
<config xmlns="http://www.griphyn.org/chimera/GVDS-PoolConfig" xsi:schemaLocation="http://www.griphyn.org/chimera/GVDS  http://www.griphyn.org/chimera/gvds-poolcfg-1.5.xsd" xmlns:xsi="http://www.w3.org/2001/XMLSchema-instance" version="1.5">
  
	<pool handle="plussed" gridlaunch="/local/gridstart" sysinfo="INTEL32::LINUX">
		<lrc url="rls://dc-user.isi.edu"/>
		<gridftp  url="gsiftp://plussed.mcs.anl.gov:4021" storage="/sandbox/hategan/vds" major="2" minor="2" patch="4"> 
		</gridftp>
		<!--<jobmanager universe="vanilla" url="plussed.mcs.anl.gov:4022" major="4" minor="0" patch="2" />-->
		<jobmanager universe="vanilla" url="plussed.mcs.anl.gov:4020" major="2" minor="4" patch="2"/>
		<workdirectory >/homes/hategan/vdl2</workdirectory>
	</pool>
  
	<pool handle="localhost" sysinfo="INTEL32::LINUX">
		<gridftp url="local://localhost" storage="/home/mike/work/i2u2/tmp" major="1" minor="0" patch="0"/>
		<jobmanager universe="vanilla" url="local://localhost" major="1" minor="0" patch="0"/>
		<workdirectory>/home/mike/work/i2u2/tmp</workdirectory>
	</pool>
    
</config>
