<?xml version="1.0" encoding="UTF-8"?>
<config xmlns="http://www.griphyn.org/chimera/GVDS-PoolConfig" 
xsi:schemaLocation="http://www.griphyn.org/chimera/GVDS  http://www.griphyn.org/chimera/gvds-poolcfg-1.5.xsd" 
xmlns:xsi="http://www.w3.org/2001/XMLSchema-instance" version="1.5">


  <pool handle="localhost" sysinfo="INTEL32::LINUX">
    <gridftp  url="local://localhost" storage="/var/tmp" major="1" minor="0" patch="0" />
    <jobmanager universe="vanilla" url="local://localhost" major="1" minor="0" patch="0" />
    <workdirectory >/var/tmp</workdirectory>
    <profile namespace="SWIFT" key="storagesize">40000000000</profile>
  </pool>

  <pool handle="teraport" sysinfo="INTEL32::LINUX">
    <gridftp url="gsiftp://tp-grid1.uchicago.edu" storage="/home/hategan/scratch/i2u2" major="2" minor="2" patch="4"> 
    </gridftp>
    <jobmanager universe="vanilla" url="tp-grid1.uchicago.edu/jobmanager-pbs" major="2" minor="2" patch="4" />
    <workdirectory>/home/hategan/scratch/i2u2</workdirectory>
  </pool>
  
</config>
